{
  "id": "phase6-topic2",
  "slug": "data-protection-secrets",
  "name": "Data Protection & Secrets Management",
  "description": "Your Journal API stores user entries, connects to a database, and talks to an LLM provider—all of which involve sensitive data. If someone gets access to your database password or API key, they can do serious damage. In this topic, we'll cover how encryption protects your data and how secrets management keeps your credentials out of your code.",
  "order": 2,
  "is_capstone": false,
  "learning_steps": [
    {
      "order": 1,
      "text": "Encryption Fundamentals",
      "action": "Read: Encryption Fundamentals",
      "description": "Let's start with how encryption actually works. You don't need to become a cryptographer, but you should understand the difference between encrypting data that's sitting in a database vs. data that's moving over the network.",
      "secondary_links": [
        {
          "text": "Encryption at Rest vs In Transit (Google)",
          "url": "https://cloud.google.com/security/encryption"
        },
        {
          "text": "AWS KMS Concepts",
          "url": "https://docs.aws.amazon.com/kms/latest/developerguide/concepts.html"
        },
        {
          "text": "Azure Key Vault Overview",
          "url": "https://learn.microsoft.com/en-us/azure/key-vault/general/overview"
        }
      ]
    },
    {
      "order": 2,
      "text": "Watch: Data Protection in the Cloud",
      "action": "Watch",
      "description": "These videos make encryption and secrets management much more concrete. The first one is a great starting point if encryption feels abstract.",
      "secondary_links": [
        {
          "text": "Encryption in the Cloud Explained (20 min)",
          "url": "https://www.youtube.com/watch?v=plv7EnY5QSo"
        },
        {
          "text": "AWS KMS Deep Dive (45 min)",
          "url": "https://www.youtube.com/watch?v=8Z0wsE2HoSo"
        },
        {
          "text": "Secrets Management Best Practices (30 min)",
          "url": "https://www.youtube.com/watch?v=pK1h7Leh_yI"
        }
      ],
      "url": "https://www.youtube.com/watch?v=plv7EnY5QSo",
      "title": "Data Protection in the Cloud"
    },
    {
      "order": 3,
      "text": "Data Security Best Practices",
      "action": "Read: Industry Standards",
      "description": "The OWASP API Security Top 10 is especially relevant—your Journal API is an API, so these are exactly the risks you need to watch for.",
      "secondary_links": [
        {
          "text": "OWASP Top 10 for APIs",
          "url": "https://owasp.org/API-Security/editions/2023/en/0x11-t10/"
        },
        {
          "text": "NIST Cybersecurity Framework - Protect",
          "url": "https://www.nist.gov/cyberframework/protect"
        }
      ]
    },
    {
      "order": 4,
      "text": "Encryption at Rest",
      "action": "Study: Encryption at Rest",
      "description": "This protects data sitting in your database or storage bucket. Think about your Journal API's database—if someone got access to the raw database files, encryption at rest means they'd just see gibberish.\n\n- Uses symmetric encryption (same key encrypts and decrypts)\n- Most cloud databases enable this by default, but you should verify it\n- Your PostgreSQL data from the Journal API should absolutely have this turned on"
    },
    {
      "order": 5,
      "text": "Encryption in Transit",
      "action": "Study: Encryption in Transit",
      "description": "This protects data as it moves between systems—like when your Journal API talks to the database, or when a user's browser sends a request to your API.\n\n- Uses TLS/SSL (that's what the 'S' in HTTPS stands for)\n- Your API should only accept HTTPS connections\n- Database connections should use TLS too—no plaintext passwords flying over the network"
    },
    {
      "order": 6,
      "text": "Key Management",
      "action": "Study: Key Management",
      "description": "Encryption is only as strong as how you manage your keys. If someone gets your encryption key, the encryption is useless.\n\n- **Provider-managed keys**: The cloud provider handles everything—simpler but less control\n- **Customer-managed keys**: You control key rotation and access policies—more work, more control\n- **Key rotation**: Regularly changing keys limits exposure if one is compromised. Cloud services can automate this for you.\n\nFor your Journal API, provider-managed keys are a great starting point.",
      "title": "Key Management"
    },
    {
      "order": 7,
      "text": "Secrets Management",
      "action": "Study: Secrets Management",
      "description": "Remember that `.env` file from Phase 3 with your database password and LLM API key? That works for local dev, but in production you need something better. Secrets management services let you:\n\n- Store credentials outside your code (no more hardcoded passwords!)\n- Rotate secrets automatically\n- Track who accessed what secret and when\n- Control which services can read which secrets\n\nThink about what secrets your Journal API uses: database connection string, LLM API key, maybe a JWT signing key. All of these should live in a secrets manager in production."
    },
    {
      "order": 8,
      "text": "Data Classification",
      "action": "Study: Data Classification",
      "description": "Not all data needs the same level of protection. Understanding this helps you focus your efforts where they matter most:\n\n- **Public**: Marketing pages, docs—no risk if exposed\n- **Internal**: Internal notes—low risk\n- **Confidential**: Your Journal API user entries—moderate risk, needs encryption\n- **Restricted**: Payment info, passwords, API keys—high risk, needs maximum protection\n\nYour Journal API's user entries are at least Confidential. Database credentials are Restricted."
    },
    {
      "order": 9,
      "text": "Secrets Management Services",
      "action": "Explore: Secrets Management Services",
      "description": "Pick the one for your cloud provider and read through the getting started guide. You'll use one of these in the capstone to replace your `.env` file approach.",
      "secondary_links": [
        {
          "text": "AWS Secrets Manager",
          "url": "https://docs.aws.amazon.com/secretsmanager/"
        },
        {
          "text": "Azure Key Vault",
          "url": "https://learn.microsoft.com/en-us/azure/key-vault/"
        },
        {
          "text": "Google Secret Manager",
          "url": "https://cloud.google.com/secret-manager/docs"
        },
        {
          "text": "HashiCorp Vault (Open Source)",
          "url": "https://www.vaultproject.io/"
        }
      ]
    },
    {
      "order": 10,
      "text": "Practice Resources",
      "action": "Practice: Crypto Challenges (Optional)",
      "description": "If you want to really understand how encryption works under the hood, these are fun interactive challenges. CryptoHack is especially well-made.",
      "secondary_links": [
        {
          "text": "CryptoHack",
          "url": "https://cryptohack.org/"
        },
        {
          "text": "Over The Wire - Krypton",
          "url": "https://overthewire.org/wargames/krypton/"
        }
      ],
      "title": "Practice Resources"
    }
  ]
}
