{
  "id": "phase4-topic3",
  "slug": "cloud-networking",
  "name": "Cloud Networking Fundamentals",
  "description": "In the previous topic you worked on deploying a VM in the cloud, using default configurations like the VPC, Security Groups etc. This topic focuses on deepening your understanding of cloud networking concepts essential for secure deployments.",
  "order": 3,
  "is_capstone": false,
  "learning_steps": [
    {
      "order": 1,
      "text": "Understand Virtual Private Cloud (VPC/VNet)",
      "action": "Understand Virtual Private Cloud",
      "description": "A VPC is your private network in the cloud - an isolated section where you can launch resources with full control over IP addressing, subnets, and routing.",
      "options": [
        {
          "provider": "aws",
          "title": "What is Amazon VPC?",
          "url": "https://docs.aws.amazon.com/vpc/latest/userguide/what-is-amazon-vpc.html",
          "description": "Amazon Virtual Private Cloud documentation"
        },
        {
          "provider": "azure",
          "title": "Azure Virtual Network Overview",
          "url": "https://learn.microsoft.com/en-us/azure/virtual-network/virtual-networks-overview",
          "description": "Azure Virtual Network fundamentals"
        },
        {
          "provider": "gcp",
          "title": "GCP Virtual Private Cloud",
          "url": "https://cloud.google.com/vpc/docs/overview",
          "description": "Google Cloud VPC documentation"
        }
      ]
    },
    {
      "order": 2,
      "text": "Learn Subnetting",
      "action": "Learn Subnetting:",
      "title": "AWS VPC CIDR Blocks and Subnetting",
      "url": "https://docs.aws.amazon.com/vpc/latest/userguide/vpc-cidr-blocks.html",
      "description": "Understand public vs. private subnets and CIDR block notation. This is fundamental to designing secure cloud architectures."
    },
    {
      "order": 3,
      "text": "Understand Gateways",
      "action": "Understand Gateways",
      "description": "Learn about different types of gateways for secure internet access:\n\n- Internet Gateway (IGW) - Allows internet access for public subnets\n- NAT Gateway - Enables private subnet resources to access internet without being directly accessible\n- VPN Gateway - Secure connection between cloud and on-premises networks",
      "options": [
        {
          "provider": "aws",
          "title": "Extend Your VPC Resources",
          "url": "https://docs.aws.amazon.com/vpc/latest/userguide/extend-intro.html",
          "description": "Connect your VPC to the internet and other networks"
        },
        {
          "provider": "azure",
          "title": "Azure NAT Gateway Overview",
          "url": "https://learn.microsoft.com/en-us/azure/nat-gateway/nat-overview",
          "description": "Understand Network Address Translation in Azure"
        },
        {
          "provider": "gcp",
          "title": "Cloud NAT Overview",
          "url": "https://cloud.google.com/nat/docs/overview",
          "description": "Learn about NAT in Google Cloud"
        }
      ]
    },
    {
      "order": 4,
      "text": "Verify your understanding",
      "action": "Verify your understanding:",
      "title": "AWS Networking Fundamentals",
      "url": "https://docs.aws.amazon.com/whitepapers/latest/aws-overview/networking-services.html",
      "description": "Review AWS networking concepts. Make sure you understand VPCs, subnets, IP addressing, and routing before moving on."
    },
    {
      "order": 5,
      "text": "Hands-on Task",
      "action": "Hands-on Task",
      "description": "Complete this networking lab on your cloud provider:\n\n1. Set up a Cloud Network (VPC/VNet)\n2. Create two subnets - one public, one private\n3. Configure Internet Access with proper routing\n4. Associate subnets with appropriate route tables\n5. Set up Security Groups for each subnet\n6. Deploy a VM in the Public Subnet\n7. Deploy a VM in the Private Subnet\n8. Verify the public VM is accessible and the private VM is not directly accessible from internet"
    }
  ]
}
