{
  "id": "phase6-topic1",
  "slug": "identity-access-management",
  "name": "Identity and Access Management (IAM)",
  "description": "Think of IAM as the bouncer for your cloud environment—it controls who gets in and what they're allowed to do once they're inside. Your Journal API already uses authentication (thanks to Phase 3), but now we need to make sure the cloud infrastructure around it is locked down too. Let's dig into how IAM works across cloud providers.",
  "order": 1,
  "is_capstone": false,
  "learning_steps": [
    {
      "order": 1,
      "text": "IAM Fundamentals",
      "action": "Read: IAM Fundamentals",
      "description": "Start with your cloud provider's IAM docs. Don't try to memorize everything—focus on understanding the core model (users, roles, policies) and how permissions flow.",
      "secondary_links": [
        {
          "text": "AWS IAM User Guide",
          "url": "https://docs.aws.amazon.com/IAM/latest/UserGuide/introduction.html"
        },
        {
          "text": "Azure RBAC Documentation",
          "url": "https://learn.microsoft.com/en-us/azure/role-based-access-control/overview"
        },
        {
          "text": "GCP IAM Overview",
          "url": "https://cloud.google.com/iam/docs/overview"
        }
      ]
    },
    {
      "order": 2,
      "text": "Watch: IAM in Action",
      "action": "Watch",
      "description": "These videos walk through real IAM setups. Pick the one for your cloud provider and follow along—pause and try things in your own account as you go.",
      "secondary_links": [
        {
          "text": "AWS IAM Tutorial (30 min)",
          "url": "https://www.youtube.com/watch?v=Ul6FW4UANGc"
        },
        {
          "text": "Azure RBAC Explained (25 min)",
          "url": "https://www.youtube.com/watch?v=C7hJ3oGHrhM"
        },
        {
          "text": "GCP IAM Deep Dive (40 min)",
          "url": "https://www.youtube.com/watch?v=96HlT4f2AUU"
        }
      ],
      "url": "https://www.youtube.com/watch?v=Ul6FW4UANGc",
      "title": "IAM in Action"
    },
    {
      "order": 3,
      "text": "Security Best Practices",
      "action": "Read: Security Best Practices",
      "description": "These are the industry-standard guides that security teams actually reference. Skim them now to get the big picture—you'll come back to them when you're hardening your Journal API in the capstone.",
      "secondary_links": [
        {
          "text": "OWASP Cloud Security Cheat Sheet",
          "url": "https://cheatsheetseries.owasp.org/cheatsheets/Cloud_Security_Cheat_Sheet.html"
        },
        {
          "text": "CIS Cloud Security Controls",
          "url": "https://www.cisecurity.org/controls/cloud-security-controls"
        }
      ]
    },
    {
      "order": 4,
      "text": "IAM Components",
      "action": "Study: IAM Building Blocks",
      "description": "Every cloud provider uses the same core concepts, just with slightly different names:\n\n- **Users** — Individual people or apps that need access\n- **Groups** — Collections of users who need the same permissions (e.g., \"developers\")\n- **Roles** — A set of permissions that can be assumed temporarily (this is how your Journal API should access cloud resources)\n- **Policies** — The actual rules that say \"this identity can do X on resource Y\"",
      "title": "IAM Components"
    },
    {
      "order": 5,
      "text": "Principle of Least Privilege",
      "action": "Study: Least Privilege",
      "description": "This is probably the most important security concept you'll learn: give users and services only the bare minimum permissions they need. If your Journal API only reads and writes to a database, it shouldn't have permission to delete your entire cloud account. If credentials get compromised, least privilege limits the blast radius."
    },
    {
      "order": 6,
      "text": "Service Accounts vs User Accounts",
      "action": "Study: Service vs User Accounts",
      "description": "Here's a key distinction you'll use with your Journal API:\n\n- **User accounts** are for people—you, your teammates, your admin\n- **Service accounts** are for applications—your API, your CI/CD pipeline, your monitoring tools\n\nYour Journal API should never run with your personal credentials. It gets its own service account with just the permissions it needs."
    },
    {
      "order": 7,
      "text": "Authentication vs Authorization",
      "action": "Study: AuthN vs AuthZ",
      "description": "You already used these concepts in Phase 3 when you added auth to your Journal API, but let's make sure the distinction is crystal clear:\n\n- **Authentication (AuthN)** — \"Who are you?\" (logging in, MFA, API keys)\n- **Authorization (AuthZ)** — \"What are you allowed to do?\" (permissions, policies, roles)\n\nYou can be authenticated (logged in) but not authorized (not allowed to delete things)."
    },
    {
      "order": 8,
      "text": "Hands-on Practice",
      "action": "Practice: IAM Workshops",
      "description": "Time to get your hands dirty. Pick the workshop for your cloud provider and actually do it—reading about IAM is one thing, but configuring it yourself is where the learning really happens.",
      "secondary_links": [
        {
          "text": "AWS IAM Workshop",
          "url": "https://catalog.workshops.aws/general-immersionday/en-US/basic-modules/30-iam"
        },
        {
          "text": "Azure RBAC Tutorial",
          "url": "https://learn.microsoft.com/en-us/azure/role-based-access-control/tutorial-role-assignments-user-powershell"
        },
        {
          "text": "GCP IAM Tutorial",
          "url": "https://cloud.google.com/iam/docs/quickstart"
        }
      ]
    },
    {
      "order": 9,
      "text": "Security Labs",
      "action": "Practice: Security Labs (Optional)",
      "description": "Want to see what happens when IAM goes wrong? These labs let you practice attacking misconfigured IAM setups—it's the best way to understand why proper configuration matters.",
      "secondary_links": [
        {
          "text": "PwnedLabs - AWS IAM Enumeration",
          "url": "https://pwnedlabs.io/labs/intro-to-aws-iam-enumeration"
        },
        {
          "text": "PwnedLabs - IAM Breaches with CloudTrail",
          "url": "https://pwnedlabs.io/labs/identify-iam-breaches-with-cloudtrail-and-athena"
        }
      ],
      "title": "Security Labs"
    },
    {
      "order": 10,
      "text": "Reference Documentation",
      "action": "Bookmark: Best Practice Guides",
      "description": "Save these for when you're working on the capstone—they're the official best-practices guides from each cloud provider:",
      "secondary_links": [
        {
          "text": "AWS IAM Best Practices",
          "url": "https://docs.aws.amazon.com/IAM/latest/UserGuide/best-practices.html"
        },
        {
          "text": "Azure Security Best Practices",
          "url": "https://learn.microsoft.com/en-us/azure/security/fundamentals/best-practices-and-patterns"
        },
        {
          "text": "GCP Security Best Practices",
          "url": "https://cloud.google.com/security/best-practices"
        }
      ],
      "url": "https://docs.aws.amazon.com/IAM/latest/UserGuide/best-practices.html"
    }
  ]
}
