{
  "id": "phase3-topic4",
  "slug": "databases",
  "name": "Databases",
  "description": "We will be using a PostgreSQL database to store our application data. You'll learn SQL fundamentals, run PostgreSQL locally using Docker, and connect to it from Python.",
  "order": 4,
  "is_capstone": false,
  "learning_steps": [
    {
      "order": 1,
      "text": "Study SQL basics",
      "action": "Study SQL basics:",
      "title": "Intro to SQL",
      "url": "https://www.khanacademy.org/computing/computer-programming/sql",
      "description": "Learn the fundamentals of SQL with Khan Academy's interactive course. Focus on SELECT, INSERT, UPDATE, DELETE, and basic joins."
    },
    {
      "order": 2,
      "text": "Run PostgreSQL locally with Docker",
      "action": "Run PostgreSQL locally:",
      "title": "PostgreSQL in Docker",
      "url": "https://www.docker.com/blog/how-to-use-the-postgres-docker-official-image/",
      "description": "Learn how to run PostgreSQL in a Docker container. This is the easiest way to get a database running locally without installing PostgreSQL on your system."
    },
    {
      "order": 3,
      "text": "Connect to PostgreSQL from Python",
      "action": "Connect from Python:",
      "title": "SQLAlchemy Tutorial",
      "url": "https://docs.sqlalchemy.org/en/20/tutorial/index.html",
      "description": "Learn how to connect to PostgreSQL from Python using SQLAlchemy, the most popular Python ORM. This is the same library used in the capstone project."
    },
    {
      "order": 4,
      "text": "Practice with hands-on exercises",
      "action": "Hands-on practice:",
      "description": "Try these exercises with your local PostgreSQL:\n\n1. Create a database and a table for storing notes\n2. Write Python code to insert, read, update, and delete notes\n3. Add a second table (e.g., categories) and practice joins\n4. Experiment with SQLAlchemy models and relationships",
      "title": "Practice with hands-on exercises"
    }
  ]
}
