{
  "id": "phase3-topic2",
  "slug": "apis",
  "name": "REST APIs",
  "description": "In the previous topic, the recommended book introduced you to Django, so you should have some context about how REST APIs work. Now let's deepen that knowledge.",
  "order": 3,
  "is_capstone": false,
  "learning_steps": [
    {
      "order": 1,
      "text": "Study: What Is REST API?",
      "action": "Study:",
      "title": "What Is REST API?",
      "url": "https://www.youtube.com/watch?v=-mN3VyJuCjM/",
      "description": "Watch this excellent explanation by ByteByteGo on REST API fundamentals."
    },
    {
      "order": 3,
      "text": "Study: REST API Concepts and Examples",
      "action": "Study:",
      "title": "REST API Concepts and Examples",
      "url": "https://www.youtube.com/watch?v=7YcW25PHnAA",
      "description": "A practical overview of REST API concepts with real examples."
    },
    {
      "order": 3,
      "text": "Watch: RESTful APIs in 100 Seconds",
      "action": "Watch:",
      "title": "RESTful APIs in 100 Seconds",
      "url": "https://youtu.be/-MTSQjw5DrM?feature=shared",
      "description": "A quick but comprehensive overview of REST APIs."
    }
  ]
}
